business_id,cool,date,funny,review_id,stars,text,useful,user_id
-Dnh48f029YNugtMKkkI-Q,0,2016-05-20 22:40:46,0,STATzCcEHqvBG_9COIadPA,5.0,"La Piazza el Forno is home to the greatest pizza in the valley! Terrific staff who are accommodating and friendly, with a pizza menu that is amazing! Love this place, and can't say enough about the atmosphere, the service, and the outstanding food! The antipasto salad is a meal that can satisfy the hungriest appetite...",0,RimQ8T9WyG7MdA0H4S4zLw
-Dnh48f029YNugtMKkkI-Q,0,2016-06-11 23:36:24,2,0E-8k7B5rbiZ-TKAwT0j-w,2.0,"Being from Italy, Florence, to be precise, my wife and I were curious about this much touted place as being authentic, to the point of resembling a pizzeria in Naples. I lived and worked in Naples for some years on the Italian hit soap opera Un Posto al Sole (a Place in the Sun). Much to our dismay we found this place to be dingy and unkept, and our table had scratch marks on it. The place could have used a paint job. Pizzerias in Naples may be small, but they are neat. This was 8 months back so maybe by now it's been improved. I can only speak of our experience at the time. The pizza was adequate but nothing to drive more than five miles for. If you happen to be in the area and want a pizza by all means stop in, otherwise go to Pizza Bianco, named one of the top ten pizzerias in the country.",1,VoxCMQQZOb9Qn8ikxArdRw
-Dnh48f029YNugtMKkkI-Q,0,2016-06-23 21:09:26,0,ceCrQDQ0uu3AssMEg_HdKg,5.0,What an amazing place. Service was warm and friendly.  The food was great. The mozzarella was so fresh. Wish I lived in Phoenix to enjoy this every week.,1,ttrK2dXJ99sCKdU1bXW9jg
-Dnh48f029YNugtMKkkI-Q,0,2016-07-27 04:50:28,1,WGL40U3-9id2ILVQcyZLUw,2.0,"Not impressed as one pizza was cold and soggy from sitting too long and the other was so thin on toppings it was doughy crust and watery sauce that I couldn't pick up and had to cut it with a fork. The pasta dish we ordered was decent but that too was on the cold side.  Would have been 3 stars but the server and hostess really didn't seem to really care that we were there. Not like there were a lot of customers to choose from and now we know why it was not crowded. You shouldn't have to keep asking for drink refills, beers, Parmesan cheese, peppers, bread and everything else when you pay for food. If they weren't so cold to deal with I was going to send the pizzas back to be heated up but I didn't dare take a chance. 
Lots of good pizza places in the vicinity to spend that much money on cold soggy pizza. Pretend like food channel is coming in again and serve the quality food you once had.",0,B3_aw0o0ncQfRgPNMEVBtA
-Dnh48f029YNugtMKkkI-Q,0,2016-10-14 04:39:48,0,cfyYMdRSXlvuGgadkZC3JA,4.0,"A cozy, affordable Napoletana pizzeria with fast service and a great vegan pizza.

If  you're vegan, get the Marinara. If you're picky about cross-contamination, as I am, request it uncut. You'll want to eat it with fork and knife anyway.

Add olives for a little extra saltiness. I always ask for a little olive oil and garlic to sop up with the crust. Good stuff without the rude and uncaring service at Cibo or the pretentious atmosphere and two-hour wait times at Pizzeria Bianco.",0,_XOFteiLMYAns2cpoGWgMA
-Dnh48f029YNugtMKkkI-Q,0,2016-12-04 04:28:29,0,3kAXmfbqWjo6LRVlyzXvJQ,5.0,My first time there. Sandy my waitress was amazing. She made my first experience a memorable one. I even got a hug . The Diablo pizza was to die for. just the perfect amount of spice . Great recommendation sandy. Can't  wait to come back and bring more friends. Till then .,0,PYeygYJDb2jBpd7V5m42Rw
-Dnh48f029YNugtMKkkI-Q,0,2017-01-04 01:54:43,0,1bMbzjYaWBRFljJs6Fi4cg,4.0,"Great food and service. The Quattro formaggi was off the hook. I ordered the pesto cream lasagna and it was good, but needed sauce layered in between because the ricotta mixture became a little dry. Will definitely be back to try the pizza!",0,ccCLVohKNhJ3ilrUvbfX4A
-Dnh48f029YNugtMKkkI-Q,0,2017-02-12 01:52:43,0,gQJFrRP2_5U0okZQ3adqOQ,4.0,Went here because our first choice was packed! What a great little pizzeria! Pizza and crust were outstanding and the arugula salad was ultra fresh. I would have given 5 stars but thought they were a little skimpy on the cheese.  Great place to have a bite before games or the opera or the Orpheum! Highly recommend La Piazza and will definitely return!,0,-znBbADZqQ_30bWe6o6rKg
-Dnh48f029YNugtMKkkI-Q,0,2017-02-20 19:02:02,0,j7aP7K7Te9KiTPOSkj78DQ,5.0,Have been here several times and have yet to be disappointed. If you go during the weekend dinner rush you might wait a bit but it is so worth it...they use fresh ingredients and cook the pizza just right. The calamari was great and the dessert? Make sure to leave room!,0,J64IzWzfkZKKrOjfIMKNEw
-Dnh48f029YNugtMKkkI-Q,0,2017-02-21 05:34:07,0,nnF6lEll0wI09naCEbhikQ,5.0,"Amazing fried meatballs as an appetizer or, absolutely delicious fried ravioli also as an appetizer and I can't remember the name of the salad but it was really good and it was in a huge bowl for more of a family-style. There was six of us at dinner it was busy but we had great service and had a mix of different food and everything was absolutely excellent. We came here because I had seen the episode of diners drive-ins and dives and knew that we were going to be in Phoenix for a volleyball tournament so we decided to stop in . So glad we did !!",0,2DToFgPh-cTPAK3VoN4-Gg
-Dnh48f029YNugtMKkkI-Q,0,2017-04-08 21:12:17,0,vgRYRZCSeI7sqFlat1nyCw,4.0,This is a cute spot with good wood fired pizza with some Italian influence. My husband and I split a pizza and salad. The Italian Stallion pizza was a must try for meat lovers. The spinach salad was also yummy! The pastas going out to other tables also looked delicious. We will definitely go back! Fun little date night spot in Old Town Glendale.,0,GnAlF-WAme946eXouIicNA
-Dnh48f029YNugtMKkkI-Q,0,2017-04-30 21:58:28,0,tP9A6LTnhPr4qJYhheWydw,5.0,"My hubby and I went here about a month ago and forgot to talk about it.  IT was a small place but it smelled sooo good.  The pizza was really good.  We both had the personal pizzas because we like completely different toppings.  The wine was a bit pricey for the brand names, but the service was great and the atmosphere was kinda romantic.  We will definitely be telling all our fiends to go there.  IT is in the heart of Glendale and worth the trip from Buckeye.",0,jD9S1crLvnAxzYEG_r_NOA
-Dnh48f029YNugtMKkkI-Q,0,2017-05-13 13:44:12,0,4huGmSb2RUgwTmi7J38qRg,5.0,"First time here. Parking is not the greatest. Restaurant has a nice atmosphere and was clean. Our service was fast, friendly, and knowledgeable. They do not have a kids menu, but did accommodate with making a small portion of some butter noodles. Coke comes in a glass bottle, which always tastes better! We had their Dolci Diavolo and Italian Stallion to eat. They both were delicious. They had a nice thin, crisp crust with a perfect chat. Best crust I've had on a pizza in a long time!",0,nbfFvGJBWZjlsI1yq55_Ew
-Dnh48f029YNugtMKkkI-Q,0,2017-07-08 23:08:23,0,OdcmTDvq-fzKbEk7Gs61Iw,3.0,"I saw the episode of \"Diners, Drive-ins and Dives\" years ago, but hadn't come to La Piazza al Forno until today.

I decided to treat my mom to lunch and we had the Italian Stallion pizza and a pizza Bianca with mushrooms and speck.  I like the thin crust with the slight char on the edges, the perfect amount of crunch and chewiness.  Great pizza overall.  We shared a slice of cheesecake which was very delicious.

Service was pretty decent, but I wish they would have included the tax on the written receipt (not that I'm necessarily hurting for the missing $4.64 in taxes, but I like to know what I'm paying for).  We happened to notice that our server seemed to be slightly exasperated, but when we looked around at her, she managed to perk up on the way to our table to serve us.  There was an older woman wearing an apron who came out from the kitchen area to greet the tables - except for ours.  It seems like she made it a point to act as if we weren't in the restaurant.",1,anMOsVqvXw9RuJLHi2Wlig
-Dnh48f029YNugtMKkkI-Q,0,2017-07-20 17:54:14,0,IH2tCB-3dobjs5tYPCcQVQ,5.0,I've been coming here since this place first opened. Always a delight to spend a day in old Glendale and have a tasty pie from this pizzeria. Everything on there menu is great. The Italian Stallion and stuffed shrimp are a must. The owner and staff are amazing and nice. Definitely a go to place to eat if you are in the area.,0,CWQAM3G8L9Vj5AyCB1h6Lg
-Dnh48f029YNugtMKkkI-Q,0,2017-08-16 13:53:39,0,ZHgCB6Fc6mWAWCFkrdkzIg,5.0,"Love this place!  My guest had the Chicken Marsala and it was tender and delicious. I had the Rigatoni Al Forno. Oh, my gosh...outstanding. Rich flavors of artichokes, sun dried tomatoes, broccoli, garlic,  rigatoni, chicken and cheese in a broth. I wish the meals came with bread...so I could have sopped up the broth with it!  We'll both be back!",0,lpNMQfpo5dIrlzyYFbq2bw
-Dnh48f029YNugtMKkkI-Q,0,2017-08-30 17:10:04,0,oQtpaMTWtA5IwPkWOFMwAg,5.0,"Quite possibly the best pizza in town. I live 40 minutes away and will come here.  LOVE LOVE LOVE.  

Plus it is obviously locally owned and family run.  Love.",0,nzoDnGgqbUS0HLUFXz6C-w
-Dnh48f029YNugtMKkkI-Q,0,2017-10-04 02:48:34,0,O_Ceqzuvbv7-9aNhTT0fbA,5.0,"Our first time! What a cozy gem! We enjoyed everything! Great pizza, for a great price! Will definitely be back! Excellent service too!",0,GFohbtyaY-R2wwSxwZLmmQ
-Dnh48f029YNugtMKkkI-Q,0,2017-10-29 03:54:35,0,dLL_5BltGLhn8bo3j44Kmg,5.0,"Today was my family's first time going and it was simply amazing! We went for lunch and got a pizza, and it was so yummy! Me and my husband are definitely coming back here for a date night. The atmosphere is very relaxing and we are excited to experience it in the night time.",0,vIH2mZI3wmNiRe5DhELI0A
-Dnh48f029YNugtMKkkI-Q,0,2017-12-17 21:44:04,0,ZjJRJvy0VF0Aabexsuyq5Q,5.0,Fantastic authentic pizza!  I drive way outta my way to come and enjoy their world class pizzas!  It doesn't get any better,0,pVC6rbUQnVIi_7X39zrlhg
-Dnh48f029YNugtMKkkI-Q,0,2017-12-31 03:27:51,0,oeUT_cX1vVhTEG-QdDeynA,5.0,The pizza is delicious!!  All of the ingredients taste fresh and the food was out very quick!  Everyone is personable and the prices are very reasonable.  I love this place!,0,IdlkR7mdu-n6-S29S0jO_Q
-Dnh48f029YNugtMKkkI-Q,0,2017-12-31 06:32:42,0,EoF0isL5NIE-tz6XzAkXkA,5.0,"Finally made it back. Still delicious, everything so fresh and tasty. My favorite pizza, too bad I live so far away. 
The crust tender, the sauce not overwhelming, just the right amount of cheese and fresh basil. One of the only pizzas I eat without meat.
Glad I'll be back this way the end of January, I see another visit soon.
Thank you La Piazza al Forno for the pizza.",0,qyKvdbXFvhWBrrApXbj5bw
-Dnh48f029YNugtMKkkI-Q,0,2018-02-11 17:59:52,0,dy95pTZXcTD4GEVG5fsfeg,4.0,"Still in search of better pizza than the average pies you find on the west side, and after reading some good things about al Forno, we decided to give it a try while cruising the chocolate festival in downtown Glendale.  All we ordered was the Filetti d.o.c. which is basically a spin off of a margarita pizza, but a notch higher on the flavor scale, and a house salad.  We added prosciutto (+ $3) for a protein with the added touch of salt.  The place wasn't super busy (and nothing fancy either, but good food and service doesn't need fancy) when we showed up at 4pm on Saturday, so the pie came out in less than 10 minutes.  Their wood fire oven is highly efficient.  As pizza goes, it didn't have the \"wow\" factor, but it was very good.  The imported pomodorini tomatoes were absolutely delicious, packed with foreign flavor, and added a touch of class to it's taste, but it definitely could have used and extra helping of garlic and basil (the garlic was pretty much concentrated right in the center of the pie, and disappeared as we worked our way to the crust).  The prosciutto was applied quite generously, but was barely cooked as the pizza was baked so quickly, and was so chewy it was hard to bite though, and doubly tough to cut with a knife.  Our only thought would have been to pan fry the prosciutto (a bit) ahead of time so after it bakes on top of the pizza it comes out a little drier and crisp at the edges (think bacon).  The salad was fresh and just fine thought the cherry tomatoes were a bit green, and are served on small plates, so you have plenty of spill-over on the table.  Over all, it was really good and a great afternoon treat, and without question the best pie we've tried west of 51st Ave.  The service was somewhat rushed as it appeared they were gearing up for the dinner hour, but better rushed than slow, right?  The unisex bathroom (there's 2) was somewhat dirty and could have used some attention, but it served it's purpose.  Overall, it was a pleasant experience and would definitely visit again if in the area.",0,olGupE_msf0Nxv9WCPrwwQ
-Dnh48f029YNugtMKkkI-Q,0,2018-02-24 19:28:11,0,aQFiiBNQWvZGXUef6rC-OA,5.0,Great food! Awesome service!!! Neopolitan Pizza is tops in Glendale!! Romantic little piece of heaven in Downtown Glendale,0,-_tUA6X_QtAFQc4nV6Dm7w
-Dnh48f029YNugtMKkkI-Q,0,2018-02-25 00:17:35,0,3ntH88u7Cw-yBM2zecny0w,5.0,This is one of the best pizza place downtown! Especially the Fileti D.O.C which has some real good Motzerella Cheese!,0,UduswB8oX7OOl8hJb1_dcQ
-Dnh48f029YNugtMKkkI-Q,0,2018-02-25 01:03:44,1,eFgMIWbIsbtAkvAdDEH5Tw,1.0,"The food is good, but not great. Service was bad. Waitress came over like once in between meal. We were there for about 45 minutes. Table next to us left and had forgotten their leftover dessert. Staff immediately took it, and a girl came over 2 minutes later for it and waitress in a very rude manner said they through it away without a care. Will probably not come back to this place.",0,PVXvHLWSUhYeToSZgKqJ_g
-Dnh48f029YNugtMKkkI-Q,0,2018-02-25 02:47:08,0,r236xwNtL0_8W6W_4Pqypw,1.0,"Tried this restaurant for the first time today.
Our salad was the highlight of the meal
We ordered the Regina Margarita pizza and added mushrooms and pepperoni. The pizza had tomato sauce. 6 pieces of mozzarella,2 pieces of basil,4 pieces of pepperoni and about 6 pieces of mushrooms we would have been better off ordering naked pizza with just sauce
We also ordered zepola which was cooked in the same oil as the calamari and tasted like it
Lastly we got the cannoli which was subpar 
I hope they were just having an off night but I will think twice before going bac",0,4O0jG6U0LlGS7Yw_4UOCyA
-Dnh48f029YNugtMKkkI-Q,0,2018-03-04 00:46:40,1,P2Xc0FKkzUTPzN7njuhRXA,1.0,"Tried this restaurant for the first time today.
Our salad was the highlight of the meal
We ordered the Regina Margarita pizza and added mushrooms and pepperoni. The pizza had tomato sauce. 6 pieces of mozzarella,2 pieces of basil,4 pieces of pepperoni and about 6 pieces of mushrooms we would have been better off ordering naked pizza with just sauce
We also ordered zepola which was cooked in the same oil as the calamari and tasted like it
Lastly we got the cannoli which was subpar 
I hope they were just having an off night but I will think twice be",0,4O0jG6U0LlGS7Yw_4UOCyA
-Dnh48f029YNugtMKkkI-Q,0,2018-03-16 04:13:53,0,3x12PyY8zBm4TF31xZWGOA,5.0,Soooooo this place is on another level of pizza!! We compared it to Grimaldi's (NY) Eataly (NY) and (LA) and I'm going to have to say it's better!! Yes folks it's better. Pizzas are amazing that's all I have to say. Try it and you will be glad you did:),0,tEpj5lAei9GniYN83bszVw
-Dnh48f029YNugtMKkkI-Q,0,2018-04-04 23:15:42,0,mWpj3amQILXJFHKdhjeoMQ,5.0,Came here while visiting family and La Piazza al Forno was not a disappointment. Food was delicious. Pizzas were incredible and OMG cheesecake was probably the best I have ever had and the service was great. Will be coming back next time in town,0,yej3j2d3PuuO-MbUL3gJuA
-Dnh48f029YNugtMKkkI-Q,0,2018-04-07 00:47:19,0,aYy-T8Mfz_jyCF6YS9wW5A,5.0,This was delicious and the service excellent! We had the calamari. It was very tasty. We also had a margherita pizza with the house made mozzarella. Delicious!!! Give this place a try!!!,0,Itux1ar12lki_hAGqdHwAA
-Dnh48f029YNugtMKkkI-Q,0,2018-04-17 15:17:27,0,HYu0aUWPjU7GRkGPHqHH4Q,4.0,This place is very popular in Glendale. Great pizza! The Stallion was a little on the salty side but still very good.,0,mhiWUEaL7MUrPtncm2ixMA
-Dnh48f029YNugtMKkkI-Q,0,2018-06-10 14:39:21,0,owRSsqlgeYaeFl45lw-7TA,5.0,"Loved this place and the food is amazing! 

The only disappointment was the service was not the best. The server disappeared several times, nowhere to be found. With only three occupied tables and you can see the entire restaurant, something must have been more important in the back. 

The food was excellent so I'm still giving five stars but don't expect the service to match the food.",0,CWoECclg8Rl1b2vnlMpvSQ
-Dnh48f029YNugtMKkkI-Q,0,2018-06-10 22:02:19,0,mx83iXhcswwKwlZjvp-4DQ,3.0,"Great pizza & probably one of the best I've ever had.   I knocked them down because they only serve soft drinks in bottles that came from Mexico.  They had no diet soda, either.",0,-sQEEUkAXwou6PxTg5zRTA
-Dnh48f029YNugtMKkkI-Q,0,2018-08-05 03:54:42,0,UlJPNbIt5wiM7NvgmZ2vUw,2.0,"Yeaaa this place used to be 5 stars. We went tonight a Saturday night normally you would wait ATLEAST an hour, I guess were not the only ones disappointed now. Sat down right away, you pay $10 for bread now, you pay $5 for a salad when you order a pasta dish, and portions are super small unless you got the special baked spaghetti. Spaghetti must have been on sale that week. The pizza crust is amazing the sauce has NO flavor at all cheese is fresh. We used to come a lot....that will sadly be our last time. We will drive to De Falcos!",0,Y4UFwGdUIq_CX5l4D60udQ
-Dnh48f029YNugtMKkkI-Q,1,2009-06-01 03:55:18,1,KCJUmcRXv3ZXbmucJRIb5g,4.0,"We drove 45 mins from east mesa to meet up with friends.  Well worth the drive for a few reasons.   Pizzas are FRESH,  simple, and loaded with flavor.  We had:

1.  Mediterranean (pesto, fresh mozzarella, and sun dried tomato) 
2.  Bianco , (white pizza with garlic, basil, feta and mozzarella).  

I love  wood fried pizza where it is soft  with just the right amount of crisp.  I tried a slice of the veggie from our friends but it was a little bland after eating the power punching flavor of the other two.  Also had a bite of the seafood pasta with red sauce, not too shabby either but this is a pizza place for sure.

This place is the perfect example of food done right.  When you combine fresh and really ripe ingredients with great cooking techniques you end up with a damn near perfect pizza.  The service was fine and the son who was featured on Triple D even came over to ask how our food was.  We will definitely be back for seconds.",3,T9ch0Z_h6LCEYwq0W2-1-w
-Dnh48f029YNugtMKkkI-Q,1,2009-06-06 04:25:43,0,znB5gPO4nUU6SI29gJ3YVw,4.0,"La Piazza Al Forno, LOVE IT!!!

Wife and I tried this place after driving by it several times, but after seeing Guy on DDD (Diners, Drive-in's and Dives) and glad we did!
Amazing pizza and the Chicken Pesto Lasagna was really good and not like anything I had before.  Count on it, we will be back!!",2,fQVeATRtU06PpqyPtvMIwA
-Dnh48f029YNugtMKkkI-Q,1,2011-08-26 03:25:06,0,Ar2mo0U4-MufFEVenFjPzQ,5.0,"Like most people, I went there with a friend after seeing it on Triple D. Since the first trip, I have been by multiple times and have loved it each time. 

There used to be a little bar area near the brick oven so I sat there the first time I went and it was great because we were able to talk with the son of the owner, I guess they are co-owners, and talk about the place and how much Triple D has increased their customer base. He was extremely friendly and of course, the pizza was fantastic. They have the best White Pizza I have every had. It is delicious and perfectly made. I have had it numerous times and have never been disappointed.

I would recommend this place to anyone!",1,dhmrAW1ppF-EgPIdTQwL3Q
-Dnh48f029YNugtMKkkI-Q,1,2011-08-26 17:28:49,1,IhI-oqZfwsv--618tWI6tQ,1.0,"Unquestionably the biggest Yelp let down ever!

I had a pepperoni pizza and it was just plain flavorless. The pepperoni and sauce was the delicious flavor of a good old water. Yum! (not).

I've never been so disappointed in a well reviewed Yelp establishment ever! Let's hope this is the first and last time!

(you'd be MUCH better served by Cibo, Pizza A Metro or Spinatos ... all within the vicinity)",4,U2sN2-HGvh27FyXKFlvkBg
-Dnh48f029YNugtMKkkI-Q,1,2011-08-28 19:57:13,2,Id6IqhX37yyRVuSESuWuIA,3.0,"I have been here for lunch a couple of times this year.  First was late winter and I had, I think, was an Alfredo pasta dish but they have changed the menu around some and it may have been the Pesto.  In any case it was very good and I even had a second meal from it.  And it came with bread.  I decided at the time to hold off reviewing the place because they take pride in their pizzas and their oven, which had been replaced a couple of months prior.  Between my visits they got certified by an outfit in Italy for their pizzas.  This last time around I took advantage of a Yelp special luncheon of a Margherita pizza, side salad and an Italian soda.  I would have preferred iced tea, especially after I found out how tart the soda was, but being a fixed special menu I did not ask.  I liked the salad.  I liked the thin crust on the pizza.  Too bad I tasted char in every bite.

In spite of all the turn off signs on the front door (no split checks, no seating until entire party arrives) my apprehension was allayed as the service was friendly and efficient on both visits.  On my second visit Justin? made a round of the guests.

Pasta 4
Service 4
Pizza 2

I would go back again, just wouldn't order pizza.",3,Z128ihQea7BLPh2T9q9sKA
-Dnh48f029YNugtMKkkI-Q,1,2011-12-04 18:22:43,0,ZTZ9QYuDSjpo5mfCvzUB8A,3.0,"So, my first review on Yelp. My wife and another couple were at La Piazza al Forno for pizza this past Friday evening, a place we've been to many times in the past. I will say this is the first time visiting since they installed a new pizza oven and received their \"Verace Pizza Napoletana\" certification.

Our pizza (the Bianca) wasn't particularly to our liking -- the crust was undercooked, thick, and doughy. Granted, we really should have said something right then and there, and asked for a replacement pizza. I chose instead to post a professional comment on their Facebook page, simply asking if perhaps they were having an off night. In a classic example of how *not* to use social media, they deleted my comment without response. Not the proper way to interact with your customers, especially since my wife and I have told countless friends about the (previously?) excellent pizza at the establishment.

It's doubtful that we'll return due to their unprofessionalism, which is a shame because we're big supporters of locally-owned, independent establishments.

Additional comment 9-Dec-11: Received a note from Justin indicating the Facebook comment delete was inadvertent, with an offer of a replacement pizza. Will post an update the next time we're in that area and try a second pizza.",6,kv9MmzW1b1YpflKxtZ4ypg
-Dnh48f029YNugtMKkkI-Q,1,2012-11-08 15:22:11,1,crfqe0K4evejUWs_0Yhd9Q,2.0,"We joined two other couples on one of our regular nights to eat out and visited this restaurant based upon the reviews, and of course, because it had been featured on Guy Fieri's show. We were disappointed. The pizza was just so-so. We all agreed we had enjoyed much better. The linguine with clam sauce and the calamari were given very good reviews. The service was OK, but even though it was a weekday nite and not very busy, the waitress refused to give separate checks and automatically added an 18% tip. We wound up simply paying thirds of the bill, even though the charges were not even.
All of us agreed this was not worth the trip.",4,MLK-c4vBBI6q19mx-g7p7w
-Dnh48f029YNugtMKkkI-Q,1,2013-05-09 17:41:55,2,LmtRXslvUUoHUWAxUyT0_w,2.0,"We came here for lunch because of DDD and unfortunately, as like other restaurants on that show, it was not as good as it appeared.  We had a party of 6, so we called for call-ahead seating and before I could even make a reservation, I was told all of the 'rules' for call-ahead seating (1.They will not seat you unless you entire party is present; 2. If your entire party is not there after certain amount of time after you said you would be there, they will give your table away; 3. You are only allowed 2 credit cards per table, no separate checks; 4. If there is a wait, you will only be allowed to dine with them for 1.5 hours).  When we got there, the place was half empty and our waitress seemed to have an attitude.

We ordered the Salvatore (San Marzano tomatoes, mozzarella, olive oil, prosciutto di parma, arugula and shaved parmesan), it sounded good, but the only flavor came from the arugula.  We also ordered the Dolce Diavolo (Sam Marzano tomatoes, mozzarella, sopressata, calabrian chilies, basil and honey), which also sounded really good, but the only flavor was from the chilies, yet there were hardly any actual chilies on the pizza, just mostly the seeds which provided a lot of heat and nothing else.

They seem to think very highly of themselves since being on DDD and having a high demand of customers.  However, I think the poor customer service and poor products are not going to lead to many repeat customers.",6,_CcD20J-KIWg6hRJmhtxEw
-Dnh48f029YNugtMKkkI-Q,1,2014-02-08 10:03:11,2,DEk6Qjdw8sMOx7nV4PJXUQ,5.0,"Finally found an awesome pizza place in AZ!
It only took me 6 years to find this incredible little restaurant!
One of The Best Margherita pizzas I've ever had!
Raviolis and sauce were perfect, and their homemade cheesecake was to die for!
True perfection!
My mouth is watering just thinking about it!!",2,EQBBL4LfbDP_MTsXmZRtdg
