business_id,cool,date,funny,review_id,stars,text,useful,user_id
-9nai28tnoylwViuJVrYEQ,1,2013-05-31 14:07:25,1,QyJSEfI7LJZDgf6OoR9GVA,2.0,"I always wanted to try this restaurant, so when it was available for restaurant week, we gave it a try.  I strongly have to agree with other recent reviewers that the service and management of this place needs a serious overhaul.  

Our service was very impersonal.  The hostess was indifferent when we arrived - barely acknowledging us when we walked into the door and struggling to even smile.  We came well before classic Scottsdale rush hour and the restaurant was not even 50% full.  

Our service was so slow.  Our waitress had very few tables and barely paid attention to us sometimes disappearing for 30-45 minutes at a time.  As an example, it took us 30 minutes for us to get our desert after they cleared our dinner plates.  She never offered coffee or after dinner drinks.  Our waitress disappeared during the whole time.    We had to ask a bus boy for help.  

Our food was average at best including very bland rice dishes and to have that at a Spanish restaurant!?! Come on.  Save your money and try somewhere else nearby.  This area definitely has better restaurants to offer.",1,wGxcpS2-N80Zn3Ns0per1g
-9nai28tnoylwViuJVrYEQ,1,2013-12-08 20:29:39,0,H0XrH3hVkPt0vUSJWH1FGg,1.0,This place is basically a good looking place at a great location that serve mediocre pricey food...not for me,1,n1JWkxYJnZsKFKKsKeGqpQ
-9nai28tnoylwViuJVrYEQ,1,2015-02-16 21:23:17,0,zMiyy1_cWnIrY1TFpiZm1Q,5.0,"This past Saturday was my second time here and I thoroughly enjoyed every aspect of it. 

We did the Valentines day menu which features an array of tapas (appetizers) and a paella.

Goat cheese-stuffed bacon-wrapped dates: One of my favorites. It's a little on the sweeter side but the spectrum of flavor in a bite will knock you off your feet.

Crab-stuffed peppers: Also a favorite; it is a pepper stuffed with pimiento cheese and crab served over a saffron sauce, I believe. I would have ordered more of these if I could.

Manchego Cheese: It was just manchego cheese in an oil (maybe rosemary?) Not that impressive

Spicy Garlic Shrimp: Get this. Just do it. 

Pork Tenderloin: Whatever sauce came on top of this is delicious. And the pork was cooked perfectly.

Adobo Beef: Also good, but just tastes like any other adobo beef.

Paella Valencia: This paella had mussels, clams, shrimp, chicken, peppers, onions and more. The flavors married well! If it's your first paella, get this one. I think I'll try the lobster and shrimp paella next time.


Mas Fi Rose Champagne - A little on the bitter side. If you're into bitter champagne, this is the one for you.",2,KP-xppgLaUx1M905B_K7Gw
-9nai28tnoylwViuJVrYEQ,1,2015-05-26 20:03:00,0,FMvevffhNbn3lwrfkyX3-w,1.0,"We picked Tapas Papa Frita from the Restaurant Week website for our anniversary dinner on a Saturday. I was hoping for a romantic spot on the patio since it was nice outside and we'd beat the crowd with our 5:30pm reservation. Inside the restaurant was pretty bare so unfortunately we were given an awkward table in the back, facing the bar and near the kitchen...probably to give the inside servers something to do...even though I'd put \"Anniversary Dinner :)\" on our OpenTable reservation/note to the restaurant. I wouldn't have minded this so much since we were isolated from everyone else, but another couple was seated directly behind us, about 3 feet away so it was just plain awkward. 

Our server Vincent was actually pretty amazing. My water was never empty and he even went out of his way to ask the chef if we could order an item from the Restaurant Week menu (since we'd strayed onto the regular menu for the paella). We ordered two items from the tapas menu - crab stuffed peppers and the patatas w/ aioli, plus the bacon wrapped dates (RW menu item), and all three were awesome. I ordered the steak + bleu cheese and my SO ordered the diablo paella. The steak was cooked perfectly but the paella was lacking some serious spice considering the title, albeit delicious and well seasoned. I also ordered the sangria, which I thought was great (and even ate the fruit). Overall we left the restaurant stuffed and pleased with our anniversary date location decision. 

And now my reasoning for the poor rating. Several hours after leaving TPF I started to get a stomach ache that, at first, felt like my stomach just wasn't agreeing with all of that food I ate, but then turned into something sinister. I'll spare you the gory details but will say that this was definitely food poisoning. Fever, nausea, the whole nine yards. I'm not sure what exactly it was - my mom blames the sangria fruit - but needless to say I don't plan on eating steak, bleu cheese, or any of the items we ordered that night anytime soon.",2,Dok_7tji5ImFr8BUMha4nQ
-9nai28tnoylwViuJVrYEQ,1,2016-01-20 05:58:20,1,dpqsHSjHFGrY53Ln1w-mxg,3.0,I have been here a few times over the last year bit was disappointed this time.  They don't offer their happy hour specials in the winter.  The bread and white sauce was good as always but the coquettes and paella lack flavor compared to other visits as did the red sangria.  The patio is pet friendly.,7,1l_O3VEl9TV_JjKAzzyz0Q
-9nai28tnoylwViuJVrYEQ,1,2016-07-05 18:37:53,0,4adTVMpR1CL3VsBA1PQPrQ,4.0,"Went here to meet friends from long ago at their suggestion.  Nice Spanish (instead of Mexican) for a change, but a bit too formal and pricy for our taste.  We decided to order paella for the table, and it was excellent.  Niceities included chef's tasting appetizers and a digestive.   We had Estrella Spanish beer and it was tasty.  This was a good place and different but I don't think we will visit it again with so many other choices in the area.  Somewhat difficult to find since it is up the hill and behind other restaurants facing the street.  Better signage could help newcomers.  Got the feeling this was a favorite neighborhood venue for an upper crust night out.",0,z6gjzFENiQf-K3lPyV79VA
-9nai28tnoylwViuJVrYEQ,1,2016-09-19 23:53:42,1,G76CS_Km54MlLEcTTW_1qQ,5.0,"I want to start by saying the food is excellent, especially the paella and the stuffed dates!   However, my review is about the owner Chef Joseph whom we met for the first time last night during restaurant week. The restaurant was packed and he was so busy.  I had my special needs brother with me and he came out immediately to make sure he was comfortable and able to see the flamingo dancer from his seat. But even more above and beyond, we had not ordered him a meal, he was just going to eat a little off our plates but chef Joseph brought out chicken fingers and French fries for him. Please keep in mind,restaurant week and packed and we did not order! Tapas Papas, you have made a life long fan and friend in us! Thank you for the wonderful food and kindness.",1,t0FoQ2BzAF9LOKOzAZtUzw
-9nai28tnoylwViuJVrYEQ,1,2017-02-12 20:46:26,0,6kNX5yDWRZ4xryXOz54eTA,4.0,"Reservation for Saturday and the place was packed!  We were seated promptly and then forgotten for awhile. Once we said something the owner Joseph made sure we were accommodated and provided us an overall great experience. Small plates of grilled calamari, tomato salad & bacon wrapped dates - yum!! Paella was also good - just good, not fabulous. Flamenco dancer with Spanish music in the background takes you away from the desert for an evening out. Very nice!!",0,5f3A2-8HEtfGN7jikb4ALw
-9nai28tnoylwViuJVrYEQ,1,2018-05-09 01:48:38,0,yT_k6124urlsle-DuT6f4A,2.0,So disappointed in the slow service. Food was nothing special after a long wait even though I made reservations. Salty dry paella after a long wait was so sad I almost felt like crying after the long wait. The environment was nice. Go on a nice walk along the water.,0,R1RDHafKh9T426DijeRixA
-9nai28tnoylwViuJVrYEQ,1,2018-09-03 16:45:30,0,n0jjO858_2LU36eEZY8yZQ,4.0,"Definitely try the chefs tasting! It was an easy way to try a little bit of everything! Service was good for us, but we were there very early. They had the band playing outside and we were sitting outside so we didn't get to hear the band.",0,E4Rqmm22EMm8tZuVLAYY3w
-9nai28tnoylwViuJVrYEQ,2,2011-03-24 00:17:59,1,RMtYRNqq4iUTwBI9FT9JCw,3.0,"As an aficionado of Spanish cuisine, I came in hoping to be, at the least, semi-blown, but resulted in a half satisfied appetite.  The biggest draw for me was the seemingly endless count of Tapas, at least a dozen in each category: Seafood, Meat, Vegetables/Cheese.  I always get a kick from trying to visualize what fun flavors can be produced from these \"exotic\" ingredients.

In my humble book, I tend to base my Spanish experience on one dish and one dish only and that is the glorious Paella!  For me, this is a deal breaker!  The pricing was fair and reasonable, but the quality fell quite short! The classic Valencia was simply, too watery! History tells me it should be fluffier, creamier and rich in flavor! On the other hand, the Arros Negre, was more pleasing and entertaining! If you never had squid ink in the paella form, it is a safe try!  The only caveat is it temporarily leaves black marks around your lips, teeth, and tongue.

The list of Tapas we tried included: 
** the best and recommended

- The Spanish Potato Pie: was not as soft and fluffy as I imagined, parts of it were choppy, mediocre taste.

- Mushrooms with Garlic and Sherry: very average, nothing too special here.

** Rabbit Stew with Bread Sauce: for the first time trying this, it was actually pretty good, tasted like Chicken!  the meat was tender with a rich flavored stew!

** Braised Oxtail in Paprika Sauce: pleasantly pulled off the bone good!

- Lamb Chops: thought it was somewhat dry, thus not as juicy as I had hoped for.  2 or 3 pieces, I believe.

- Calamari Rings: the batter was light and cooked perfectly, accompanied by three different sauces, that I cannot recall the names to, but nonetheless, tasty.

- Snails: average, nothing to spectacular.

The pitcher of Sangria was too small for my usual liking, it filled just 4 small glasses and lacked the wine taste.

What I liked the most was the atmosphere--live music created a fun mood and the rich detail of the Spanish-esque decor to bring everything together.

Since I was here for my birthday, they did bring out a complimentary flan that I thought tasted a little eggy? The cool part was partaking in a Spanish tradition where the server shoots a long stream of wine into your mouth. 
 
Overall, the experience here was just average with mediocre flavors among the Tapas with some exceptions, thus, I would only return for the Squid Ink Paella, Rabbit Stew, and Braised Oxtail.",6,8DGFWco9VeBAxjqsuh1aSw
-9nai28tnoylwViuJVrYEQ,2,2014-10-27 06:51:19,1,3bb4sy5cCY5CUh8UWujpLA,5.0,"My husband and I always go to Tapas Papa. My husband is from Spain and he loves the paella and pretty much everything. I enjoy the tortilla de patata, chorizo, croquetas, everything! This is very authentic Spanish food and I'd recommend to everyone! People is friendly and they also have good drinks :)",0,e61syRhm2ShwIixzy-WR-Q
-9nai28tnoylwViuJVrYEQ,3,2010-08-21 23:23:18,2,tiMOibh6xvIuD8Y9eUpmeA,3.0,"Decent if you're jonesing for tapas. (This is not a paella review. Yet.) I apologize in  advance if this comes off as one of those reviews that makes managers and PR firms cringe. I know you can't do authentic tapas in Southbridge/Waterfront and stay open. But I have to rate it honestly, or not at all.

I remember the original TPF on Camelback, I think where Sportsmans or Tarbell's is now. I recall it being exotic and delicious, with the right intimate atmosphere. My memory could be clouded by lack of experience at the time. But overall, *this* place is a little too big, clean and corporatey to match an authentic tapas experience like you'd get in Barcelona, or Basque Spain, or some of the real deal places like in NYC. I don't think you can be located where they are and pull that off. So it's dumbed down a bit for the market. I think if you're not on the search for a super authentic, intimate experience (small bar, communal tables, etc) it will fit the bill.


ATMOSPHERE
Big, open, lively and trying a little too hard, IMHO. The uniforms look like Halloween costumes. It comes off a bit too kitschy. Staff all seemed pretty friendly, if a little harried. The live music is a nice touch, even though pretty low energy when we were there. I'm anxious to catch some Flamenco though.


SERVICE
Our server, Timo, was the epitome of charm and enthusiasm. Big thumbs up for him. But timing was all over the place. First round of drinks took  f-o-r-e-v-e-r. We saw other tables clearly looking around for their servers. Not sure if the bar is the hold-up or what. Food took much longer than expected as well, since we didn't order paella or anything that was likely made to order. Once the food started coming, we got it all pretty quickly.


DRINKS
Man. Do not order the mojitos. I admit I'm pretty picky about them. I love making them at home. I want them muddled fresh and I want to taste all the ingredients. They have a \"pitcher approach\". It's like they have mojitos on tap. I asked for a fresh mojito, not a whole pitcher. I just wanted to try their mojito, and then move on to an Albari침o or some other wine. I got the pitcher anyway. And what came out was refreshing alright. Much like ice water is refreshing. Basically clear liquid with some rum aftertaste. No detectable lime. One sad little shred of mint in each pour. Very little sugar. The pitcher approach works well for sangria, obviously. But do not do this for mojitos. Doesn't do them justice. My wife's red wine choice (a pintoresco by the glass) was very good. A friend who tracked us down there after a Yelp check-in said the sangria was very good. So there you go.


FOOD
I'll point out the stand-outs:

Boquerones
Fresh white anchovies in light oil. Delicious. Smaller than I've had elsewhere. A little more body to the fillet is nice. But a great light dish.

Rabbit Stew
This one gets you bang for the buck, if you're not averse to eating cute little bunny rabbits. Lots of tender delicious sweet meat in a light tomato broth with a nice acid too it. Bone-in meat ensured lots of flavor.

Shrimp a la Plancha (or whatever they called it)
Head-on, shell-on shrimp. Messy to eat unless you crunch the whole shell. Not quite crispy enough to allow for that though. So mostly we peeled them. Quality white shrimp with real shrimp flavor. Not the rubber you so often get with grilled shrimp.

Oxtail Stew
This should be so up my alley. Classic mirepoix dark stew flavor. Did I detect a little store-bought demi-glace starter? But it could have been braised a bit longer. Like a couple more hours. There was still too much un-rendered fat and connective stuff; not enough meat.

Basque Sausage
Not memorable. If you've ever gotten the Spanish Chorizo from Schreiner's, or LaTienda.com, you'll know what I wish it was like. When we get the Schreiner's, it never makes it through the car ride home.

Mix of Snails, Sausage and something else
Didn't do it for us. No individual character to each of the proteins. Just a mash-up of savory chewy bits. Be a pretty good starter bread dip if you were hungry, but not a great dish.

Pan con Tomate (pan boli?)
For me, this is a benchmark item. This would have been better if the bread had more chewiness and structure to it.

And of course they have all the stand-bys like Potatas Bravas, Fried Squid, etc. And Paella. Next time, I'm trying the Valenciana for sure. That alone could add a star if the flavors are there. But there better be smokiness, bone-in dark meat chicken and the rice better be crispy on the bottom of the pan.


So, just A-OK for now.

I could see an updated 4 star review once...
 a) I've further explored the menu and know what all the gems are, and learn what to avoid, for my taste.

 b) they fine-tune the service and hopefully work on the authenticity. the crowd that was there and the location don't give me much hope for tuning toward the more authentic. if anything, i fear it being dumbed down even more.",6,axGqLJ9UWb7P4sBXafOeeA
-9nai28tnoylwViuJVrYEQ,3,2015-09-11 19:49:51,1,HvZKZ0XC0eOXCAF1PnLZVQ,5.0,"Although having vaguely heard of Tapas Papa Fritas, and a connoisseur of excellent Spanish Cuisine - I didn't pay much attention to this eatery, I am very astonished to say, because of its name - Fried Potato Snacks!  Boy was I wrong!  Being of Spanish heritage, I was flabbergasted with Tapas Papa Fritas' traditional atmosphere, an atmosphere emitting Basque, Andalusian, Moorish, Castilian and Asturian regions feel, d칠cor and food!  This appealing and large eatery smacks of being in Spain!  From being almost obscure in its external surroundings, once you step up the path to the front door, past the traditional-style plant-filled veranda, see their fabulous outdoor seating area, you have arrived to the old world of Espa침a!  Having grown up in a Spanish-Cuban atmosphere, I am well versed in the fare offerings, what I should anticipate both traditionally and in any nouveau prospects.  I was impressed and satisfied!  While absorbing the atmosphere, we were seated near a window whereby we had the opportunity to admire both the inside and outside, as we experienced a fine bottle of Pinetti Notte Pinot Grigio Delle Venezie 2014.  My wife and I were pleased to see some of the old-world as well as fine-dining traditions followed by our Server, Sina who showed his expertise in not only fine proper serving, but old-world rapport, pleasantry and knowledge.  Elegant service from table cloths, silverware and the use of an enoteca for wine.  As newcomers to the establishment, we decided to try something that would give us the widest array of samplings, so we started with their Tapas Deluxe Special which included: Gambas al Pil-Pil, Chorizo, Txistorra, Stuffed Dates, Queso Manchego, Chicken Skewer, and a Lamb Shank - all prepared and served to perfection.  And, just as is in the Old World, no rush... patience, enjoyment and privacy abound.  We then went for the main course.  My wife thoroughly enjoyed (I did too) her serving of Paella Valenciana in a traditional style with saffron rice, fresh clams, mussels, shrimp, tender chicken, extraordinary txistorra, peppers, onions, tomatoes and peas - beyond delectable it was!  I proceeded to have their incredible rendition of Conejo (Rabbit) Romescu Catalan-style, with a soft to the palate peppery tomato almond sauce over an excellent rendition of traditional saffron rice.  If you enjoy rabbit as I do, this dish is for you - amazing!  I believe it needless to say, by the end of our meal, we had no room for dessert of which they have a wonderful assortment of Spanish selections.  It is no wonder why this eatery has received the accolades it has on media, from critics and awards alike -the food, the atmosphere, the staff, the accoutrements and the vibe are magnificent.  Our profound kudos to Chef Joseph Gutierrez and his incredible art.  As unfortunately so many 'Traditional' Spanish in the Valley and across the country tend to do, sway to changing the great things which don't need changing from our past - the only nouveau here is the first time patron.  We look forward to visiting them as frequently as possible to get our taste buds wrapped around more of their fabulously authentic cuisine, Flamenco shows and live Latin music during the weekends.  Can't wait for the next visit.  Excellent ambience, service, hospitality and food - next time I'm going for my favorite: Zarzuela (Seafood Stew - some may know it as Spanish-style Bouillabaisse)!  Bon app칠tit!",5,r_Q6zhem0pJhvLcvp3YTXw
-9nai28tnoylwViuJVrYEQ,20,2015-07-03 19:03:33,17,LmqY9v-GMHb5YqyFaYC6cg,3.0,"Well nothing takes you back to Spain like getting on an aeroplane and flying there when the finances are right. But here in Phoenix, if you can settle for watered down sangria for $8 a glass, no bullfight, and no cigarette smoke then dining at Tapas Papa Frita is recommended. On weekends you can enjoy entertainment with dinner.

The menu is large and heavy and of a reddish background color, so it was a bit annoying to read through. But of course being from the Yelp community I pre-read it online and already had an idea of what I would get. Go figure I was asking everybody else if they were ready to order yet.

Other reviewers have complained about the lack of service. That wasn't my experience. In fact I feel like we were over served. I had to give our waitress the evil eye for popping over every two seconds while we perused the menu. And at meals end she insisted on taking our leftovers to wrap them herself instead of bringing containers to the table.

There were several selections of vegetarian tapas. Few were vegan, some prepared with cheese or type of crema, one had ham (which I'm unsure why it would be listed in the vegetable section). 

Having tapas is kind of like building your own tasting menu, and we didn't hold back. Here are the uniquely tasty morsels we tried. 

1. Pastel a la Porrusalda: Leek tart in a pastry - 6.50
Liked it, but the dough was a bit chewy

2. Champi침ones al Jerez: Braised mushrooms with garlic and sherry - 6.50
Liked it, but not too flavorful

3. Pimientos a la Riojana: roasted peppers with olive oil - 7.50
Liked.

4. Patatas Bravas: Spicy red potato wedges - 4.95 
Liked them, but they had crema on top and were not spicy at all.

5. Tortilla de Patatas: Spanish potato pie - 4.50
Liked, but it was dry.

6. Escalivalda: Peppers, onions, eggplant, tomatoes, garlic over bread - 7.00 
The veggies were good, but had a tangy taste.
Did not like the bread, it was hard and not garlicky.

7. Cabrales con Menbrillo: Cabrales cheese with quince - 9.00
So-so

8. Setas con Queso De Cabra: Stuffed portabello with goat cheese - 9.00
Recommended by the waitress. Liked it, but it was too small. 
I expected a burger sized mushroom, but it was about a third of what I expected.

9. Pollo al Ajillo: roasted chicken thigh in lemon garlic - 7.00

Having gone through the basket of white bread rolls and aioli and all these tapas, we were getting full. But entrees were coming. 

1. Pollo con Jamon: Ham and cheese wrapped chicken breast with capers, and guindilla sauce - 16.00

2. Paella de Vegetales: Seasonal garden vegetables with saffron rice - 16.95 

Although the paella was tasty I would not order it again. As a rice dish with cooked veggies the whole thing just had a mushy consistency to me. One spoonful was more than enough.

And now for the sweetest ending. No spanish dinner is complete without some churros. But share one dessert? Not at my table! So we also ordered the Pastel de Pan: banana and apple bread pudding with ice cream - 6.00 

There's no point in saying another word about the bread pudding. If you like bread pudding then try it. 

Cut to the churros. Oh dessert heaven...the churros! Churrrrrrrrros. I felt like dancing around the restaurant stomping my heels like a flamenco dancer and instead of clacking castanets, I would have churros on my fingers.
 
Churros con Chocolate - 7.00
Served warm, stuffed with hazelnut/caramel filling (??) and with a side of chocolate. 
Unfortunately they were coated in a lot of unnecessary sugar, but delicious just the same.",18,X5T45QxyLjnuXohkvE3Rfw
-9oLjjh2AW0FqgLy_Yv4ZQ,1,2018-08-13 21:04:47,0,NRMZKWZvmKJLS31A5ZCkvw,5.0,The moment I stepped into this church I was so inspired and felt so welcomed. Every staff member and volunteer always has a bright and warming smile. We love this church so much my boyfriend and I decided to get baptized here. Definitely will be continuing to go to this church from here on out!,0,5f2HwadMQMoYmduniq5s6w
-9oLjjh2AW0FqgLy_Yv4ZQ,1,2018-10-07 21:42:59,0,ycUTPMFJVnEgHw7-8qDD4Q,5.0,We came today for our first time. Everyone was so nice and welcoming to us. Since we were new we checked in at the newbie tent and got to know a few people. They ya anger set up so my kids could go to the youth ministry. My youngest had a blast in the kids group. My high schoolers sat with me in main service and will be attending the high school youth group tonight (Sunday nights). Overall we really loved it today and may be calling this church our new home church.,1,4m68MVNjlj-HTsUzmc3ASA
-9xZZLLxuQabvBDODqpM-g,0,2017-01-03 17:38:40,0,wjJNZ-H3xeGQn0kVIskQIA,5.0,"I highly recommend this cafe/hookah lounge! I came in for a cup of authentic Java and end up staying for hours, best hookah in town!  The ambience is perfect :-) Mediterranean music is awesome :-)) staff is so hospitable...A great place to order a cappuccino, authentic pastries, they have the best hookah! It's a sheek spacious lounge with plenty of tables and leather comfy couches AND I got to connect to free-wifi all at once!  I sure will tell my friends!  And did I mention service!  I give this place a thumbs up",0,qWmjVlHDCxiGQwjBO9Jwng
-9xZZLLxuQabvBDODqpM-g,0,2017-01-28 04:11:08,0,8Rnl3ZA-NGjvs8KP3XFg9A,5.0,"my first time in here, and im already in love with this place lol.
7abeet their Konafa the most!",0,0pDli16gkCf1nAfl5Dr2FA
-9xZZLLxuQabvBDODqpM-g,0,2017-01-28 05:01:20,0,SS3s3YGRaoOf6JGlmvJ0nA,5.0,Favorite hookah place in town at the moment. Staff is very pleasant. The hookah is clean and smooth!,1,ayibPXI_64nxEXc4N9A7_w
-9xZZLLxuQabvBDODqpM-g,0,2017-08-30 06:13:23,0,ZFxIkUTIvodzO7hd4pklzQ,5.0,"This place is my new favorite chill spot. They have a nice space interior with comfortable seating. On the patio they have very comfortable couches. They have wifi so you can come read a book or your laptop. In the evening they turn on musters and fans on the patio so it's nice and cool. The staff is very friendly and accommodating especially Jasmine! They also serve sandwiches and drinks, and you can bring your own food. There is a nice middle eastern restaurant right next door with delicious food!",0,T1TI-1x4TJB7V-nJhaP_NA
