business_id,cool,date,funny,review_id,stars,text,useful,user_id
-45kMvS7h38CGaWugPY0rg,1,2018-05-19 21:58:46,1,GAtcEyHrlIsWANEOBbltrg,2.0,"Overall a disappointing experience. After reading about this place and seeing the Yelp reviews, we were excited to check out Roland's for brunch. I should've noticed the big red flag when all of the Yelp reviews were from Elite members...special treatment or event maybe?

We arrived around 10:45 on a Saturday to be told that breakfast ends at 11. For a week day I understand, but I've never seen a place end breakfast so early on a weekend. I guess they don't want a brunch crowd? We were waiting for friends and I specifically asked the waiter if it'd be a problem if we ordered breakfast a few minutes after 11 once our friends got there. He went to ask the kitchen and came back assuring us that there wouldn't be a problem. I guess this was a total lie. We placed our coffee and breakfast order and got ready for a fun brunch. A few minutes after we ordered a different staff person came to our table and told us we needed to change our order. I explained that we were told it wouldn't be a problem but he didn't really seem to care.

The items we did order for lunch were all mediocre at best. The French fries were good but that's about it. We were extremely disappointed and expected better customer service from a restaurant from such acclaimed chefs. 2 stars for decor and overall vibe.",6,GcJH_WwtGbxrXliynBGw2A
-45kMvS7h38CGaWugPY0rg,1,2018-05-20 02:59:53,1,jvhcQjFyt77DUrITP_B_DA,5.0,"Loved the Pollo Asado Sandwich!  Great atmosphere, good prices, great staff.  Also loved that their ceiling and building is over 100 years old.  Will be our new hang out!",2,Uqti0GZKS-O65xqsxhwwrQ
-45kMvS7h38CGaWugPY0rg,1,2018-06-09 23:15:04,0,DYMyZM42ctDibwEZ-PPjvA,4.0,"Went to the new Roland's Cafe for breakfast this morning and left with such a satisfied feeling to start my Saturday.  Was pleased off the bat to find Roland's offered fresh-squeezed, orange juice to kick off my day.  I sat facing the window and unexpectedly noticed Camel Back Mountain.  Roland's Cafe is on Van Buren west of 16th St., where the mountain is east of 44th St and Lincoln, this fact did not diminish the most pleasant view from this cafe.  An urban setting with the mountain in the background is just what I like.  
My order of rice bowl with veggies and an egg arrived.  I also included refried beans and corn tortillas on the side.  The brown rice was well-cooked as were the veggies.  The egg was sunny side up and mixed well with the rest of the meal.  I ordered four, freshly-made, corn tortillas and refried beans then proceeded to chow on the salsa trio with green chili, green sauce and red sauce.  
A dessert was in the offing when I asked if they bake their own stuff.  The choices were awesome from sugar cookies to scones.  I picked a rye cookie that was nicely baked with cinnamon and sugar.
The view of the mountain made the trip special to Roland's cafe and the food is gonna bring me back for more.",2,Ke3dy_sffxlSt7cuqvgFuA
-45kMvS7h38CGaWugPY0rg,1,2018-08-24 16:14:04,1,qusSGt6tgZHMC1t7pe0TkQ,2.0,"Upon arriving, the parking lot was full but luckily there was a spot open right at the front during Saturday brunch. The restaurant is spacious and the windows are great with the brick exposed. The kitchen is open and there's a coffee bar right as you walk in. We got water immediately and the service was friendly, consistent, and quick. 

Ordered the red chile pork which I felt lacked that authentic red chile flavor and it was a little dry for my taste. I'm used to my grandma and mom's red-chile which is more of a soup and deep chile flavor without it being spicy. My daughter agreed that salt was missing. The beans were whole, which I wished were mashed instead, and the eggs were just as expected with a side of what looked like a fresh flour tortilla. This dish was disappointing though.

The chicken tinga tostadas were plated nicely and full of meat and toppings. It comes with a side soup which I thought was salty, which was opposite of the red chile. This dish was better than the red chile though, but I wouldn't come back to try anything else.

It was overpriced, and the flavors weren't there for me. It's no surprise who is giving high reviews, given they're not familiar with home cooked Mexican food.",1,4W-ZU-E82HWWUNNk9tfN6g
-45kMvS7h38CGaWugPY0rg,1,2018-09-04 02:27:21,1,MEsYb6lxZ2mh4vfUNreUsg,3.0,"Stopped in for lunch on Labor Day. Parking lot was full, but plenty of street parking available. It's a great historic looking building and quite spacious inside. Our server seemed a bit inexperienced, but was friendly. Not a huge menu, but everything seemed reasonably priced. Mostly Mexican lagers on the beer list, bit did have some good local beers on tap as well. We tried the Colorado burrito because it had gotten some rave reviews. Really wasn't that impressed. It had good flavor and was wrapped in a tasty tortilla, but the  pork was kind of gristley and chewy. We will be back to try something different, and hope for a better result.",3,B_lGMaVZMEJDmgxGJjAeyQ
-461KOozus5M0Px02uyRgg,0,2019-06-02 04:31:09,0,Oyv1vLfCEwv9lo9bJwvgYg,1.0,"Alicia has horrible customer service. As I walked in and she started yelling at me screaming about I couldn't dry my clothes. I couldn't believe how hostile she was. I opened the door she was jumping up and down, yelling at me I couldn't dry my clothes. After months of coming here to dry my clothes. I walked in a few minutes before 9:20 for a 32 minute dry and she yelled at me. Very upsetting guess I will have to find a new place to dry.",0,WJHV4pJVfVzqAC_hZyB6IA
-461KOozus5M0Px02uyRgg,0,2019-07-07 04:47:54,0,92G_cQkZvszeHNC3MUYa-Q,1.0,"I used the wash and fold service which I have always found to be convenient, if a bit pricey. It is $1.50/lb here which is fairly reasonable. I dropped off 25 lbs of laundry in the morning, and was told it would more than likely be ready the next day (and they would text me when complete).  I get a text 7 hours later that they have completed my laundry. I drive over there and pick up my laundry. I had specified to have my work clothes hung up, and they did hang the shirts up. The pants were folded, not a huge deal, but not what I asked for either. As I was putting everything away, I started to notice that some items were missing.  I texted the number from earlier and didn't get a prompt response so I called. The person on the phone was able to find the missing items and I immediately headed back in. Unfortunately, I am 25 minutes each way from this location and only came here based on the reviews. When I finally got back there, there was 2 bags of laundry that they had mixed together. I was told that they \"had a stressful day\", and had to go through the laundry to pick out which items were mine and which were the other persons. I have used a wash and fold service around the country for years during my business travel, and this was truly a first!  I was offered a free load (not sure what that would entail) if I came back, but given my experience I don't think this is likely...

TLDR version, quick convenient wash and fold service, just make sure everything is there when you pick up.",0,W5KgKOOq0DEP00oX5lQflQ
-461KOozus5M0Px02uyRgg,0,2019-08-20 17:43:05,0,gTCDFJRqa0C1LaP7w3pNQQ,5.0,"This is an awesome laundry mat! I come in about every other week and the facility is always clean, stocked with change and supplies, and has an attendant!",0,B7-yJCS9WiQedDHzoZuCAQ
-461KOozus5M0Px02uyRgg,1,2018-11-20 15:05:26,0,ILDPu0iTv3CmhCx2NP9nuw,3.0,"This is a laundry mat but don't get crazy.. smells, clean kinda, and way to pricey to use the machines, local area is cool.. may not come back, staff was noce",1,zMWDSnGjC2M_v-Ygsnridg
-461KOozus5M0Px02uyRgg,1,2018-12-20 13:52:20,0,dZp_Hk7wnoRRnsoqUfI-qQ,3.0,Lots of machines out of order.  Place could use an update but machines that did work were clean.,1,BosXwlcRIb_sdlSsvst6Pw
-4bpDsuRmpjWjxrtdYfJQA,0,2019-01-13 02:46:44,0,sekNrAibFMiRrOaKHDudWw,5.0,The workers were very knowledgeable and helped me pick the right dog food for my beautiful puppy. They gave me samples to have my dog try and walked me through the store showing me other useful things. Very thankful for their help! They have helped me find a dry dog food that has helped my dog's digestive system!,0,Gosq4saQ2vGfXsyRk0WQLA
-4eA7Um2eiOKsGLmcXNx_w,3,2011-04-27 15:33:39,1,PY-YfLd5SKJScK-XQGSkpA,3.0,"Giving it a solid 3.5 stars.

This place is like a modern and bright version of the The Mascot over on Queen West. I think Furbo goes well with the Distillery District and while I was there all I could think of was that it would make a great venue for a private event, they had a decent wine list and beer available but the overall lack of food was a downer for me, I had a chocolate croissant which I wish I had warmed up but was delicious nonetheless.
My latte (lacking the art) was not the type of drink I have come to enjoy, just gave that strong bitter taste I'm not a fan of. My friend also noted her drink was not amazing (can't recall what she got though). 

But everything else in here is very nicely done, nice art to gaze at while seated and funky artsy furniture to sit on enjoying the free wifi. I will definitely be visiting again as this place does have the chance to make it up to that 4 star region.",2,9W73B44Iw8WslrTNB2CdCg
-56TP_w4VG2oNGpauDMOOQ,14,2015-11-01 15:57:01,14,9qv2gVvyGsCFgxrBXRzqhA,3.0,"I had NO IDEA this was called Peachtree Center even though I've been coming here for a decade and a half. THANK GOD FOR YELPERS AND YELP. Yea, we always called in mong gok because that's what it's called in Chinese. I actually just went not too long ago, and they changed the sign to \"New Kennedy Square\", although I still see Peachtree Mall on one of the signs.

A couple stores have changed since this plaza has opened, but there have been shops that have been here for decades, like the store that sells popcorn and cotton candy. Or the store that sells sugar cane drinks. More food court booths have opened here, though the one that is directly in the middle of the food court always seems to close, probably because feng shui isnt as great in the spot, no idea tbh. 

The not so dollar, dollar store is here selling any item you can think of. There are fewer bootleg dvd shops as before. I remember bootleg dvds were like $20 for 3 or $10 for 3 when they were popular in the day. 

Parking can be difficult during peak times such as Saturday for dinner, but you shouldn't need to wait long for a spot.",16,jlu4CztcSxrKx56ba1a5AQ
-5QWiL1jpzQDpQSVyaP6Lw,0,2015-07-06 05:15:49,0,Be4I2UahgXLpnmJrf5TrYw,5.0,"Best place to buy a mattress. My wife and I got the Simmons Black Beauty Rest for such an incredible deal. Tried to find an even lower price in town but everyone else was only confirmed what an incredible deal Sleep Source gave us.  The manager was the store owners son in law, I think his name was Jeff, and he was such a great guy to work with.  Our mattress didn't come with a law tag for whatever reason but Jeff obtained all the warranty information for us and even went the extra mile and registered our mattress with the manufacturer to give us that peace of mind. He provided ample documentation to support our warranty as well. Such a comfortable mattress.  My wife and I have the most comfortable and restful sleep. Thanks so much Jeff for giving us such a great deal.  This is a late review (I actually bought this mattress 2-3 years ago) but as I'm laying here on this mattress I can't help but reflect what a great buy this mattress has been. Thanks so much!!! Highly recommended 5 stars all around",0,zmYjNd2enUJz5oV7mJ2AtA
-5_LWiptQbtzYbrElZDX9A,0,2012-05-01 07:26:38,1,H1lbcf9vUxSmEui0DJ9bzA,5.0,"Great Store ~ Great Staff  ~ Great Buys ~ Great Birds ???

Have purchased a number of items here and have always been satisfied.  From lawn mower to snow blower (at a huge discount), and ladder to toilet---everything performs beautifully.   

They also have a general 90 day return policy which I took advantage of because of faulty solar lights that stopped working after just 2 months.  Never had to return anything else because they all work---whether blowing, mowing, growing, brushing, or flushing.  

Especially satisfied with their outdoor plants.  Always healthy when purchased and continue to flourish---annuals, perennials, and herbs.  House plants, too.   And if you're looking for any larger decorative garden pieces, such as metal trellises, gates, panels, and shepherd hooks, they have quite a nice selection.  

Because a vast section of their outdoor garden center is open at the top---like an enormous cage in a zoo, but without roofing on one side---don't be surprised to be looking at something and all of sudden birds fly past---right in front of you---just two feet away---at eye level.  And there's constant chirping and tweeting.  Pretty cool.  Actually, it's like an aviary.  They even build nests in the rafters.   I've never had it happen, but you might want to wear a hat.   Just in case.",1,Rf730nsizp41XCIsHLjQeQ
-5_LWiptQbtzYbrElZDX9A,0,2017-07-10 17:27:42,0,vFCOWVN-DeEA-1w1wmap2w,1.0,"The worst experience I have ever had. Went to this store for a few items. Spent more than an hour and a half looking for items, either given the wrong location of items or they didn't know ! Finally in desperation I asked to talk to the Manager. After waiting for the Manager I told him of my experience! I told him I wanted just a plastic putty knife. Took me to the isle and they were out. None in stock ... really . Called home office and I was told I would get a call in 24 hours. Never happened ... obviously Lowe's doesn't need the business!!!",0,5L6ecOTOjqf9LiCUz5Uwng
-5_LWiptQbtzYbrElZDX9A,1,2016-09-07 17:57:17,0,BsT7EUpIel6LD78DvKE5KA,4.0,"Good people here. 
Not a fan of the giant home center stores, but I'm always greeted with friendly and helpful employees at this location.
Thumbs up for this one.",2,l8lA-Kgw0as97qdK7Ufdaw
-5pn5F6pFkbrBv6L8d8CoQ,0,2010-11-27 16:03:18,0,12eivkhjbti_0YKnjZnS8w,3.0,"Energetic staff and great milkshakes. One of the last places unafraid to make a real honest to goodness creamy shake.  The all day breakfast is a nice touch, though the \"Supreme Commander\" pizza was a bit bland.  Service is hit and miss depending on who you get.",0,aF2zZHEw-kkN9sgNnBeNNw
-5pn5F6pFkbrBv6L8d8CoQ,0,2012-10-13 17:05:45,0,rGBcXV6qBseNX5GNRr54GA,3.0,"Went here for breakfast on a busy holiday Monday the service and food was fantastic! Had the breakfast special, food came out fast and fresh.. Also came here on a slow Saturday afternoon for lunch and it was consistently good!",1,qpa9Dmi7YY3zvnLLKKDDjg
-6AFQalhxzBHv6flajuo_w,0,2015-09-10 01:15:51,0,pHxlpfbtbyS5naLnV50jqg,5.0,This place is awesome love. The people and thier work highly recommend  they go out of their way to please high fives I would drive a long way just for the wonderful experience,0,R9Bm86DXed10xMvhJrcDdQ
-6AFQalhxzBHv6flajuo_w,0,2015-12-05 15:08:54,0,kzdqZlKNacqSnlvsyDzbOw,5.0,The man that did my nails was so amazing! I believe his name was Joan or John. This was the first time I got my nails done and he did it exactly how I wanted it to look. He also communicated and created conversations with me and his other customers! :),0,qqf3Gc3j0nSu0OPSJIxn7A
-6AFQalhxzBHv6flajuo_w,0,2016-08-04 01:42:02,0,2eIlKK-IC4uc8MFKljN_zA,2.0,"The  people here are really nice   , it is also very clean . I really like the way the girl did my nails  she has dark hair with bangs I'm not sure of her name the guy John that did my nails   He was very nice shape was perfect but I was a little dissapointed with  the out come  I told him I wanted French with a glitter gel he proceeded to show me a picture on his phone  they didn't come out anything like the pic and thy where a bit bumpy but the color was cute just not what I expected and he didn't put the clear on the whole nail and when he was putting the acrylic  he filled it really low ,  I asked him nicely if he could fill it a little thicker , he said it's fine , it was fine for him because he wanted to be cheap but charged me 65 for a gel fill , I have never paid this much for such a sorry manicure , but the women here did a great job would recommend this place but just make sure that you are very clear about what you want.",0,cPqKYbwPJ_MwUL8wwlh9Aw
-6AFQalhxzBHv6flajuo_w,0,2016-08-04 18:25:55,1,Xph7E-chZWoVKHmvL0E5BQ,1.0,"I'm a below the knee amputee. I went for a mani/pedi.
I was charged full price for my pedicure and 7.00 more than the advertised price for my fill!!!  My FOOT is rough and the polish is chipping! 2 nails are broke and one is chipping! I DO NOT recommend going here.",2,Qy1xSyiVqE0FZ1ej86R_Dg
-6AFQalhxzBHv6flajuo_w,0,2018-03-17 02:42:26,0,ngvDOGRRgNJNo6eJpthQ3g,1.0,"I was becoming a regular here coming to do the whole nine yards: nails, toe nails, waxing, etc. Only because my regular place is by my house and I needed something closer when I'm off of work on the other side of town. At first they were very nice to me. I always tipped very well, brought them customers etc. I don't like feeling I'm taken advantage of and today is the last straw. If I call and you're open, and your light says you're open and I come in and you have several employees and only 1 person is being serviced I expect service. I also don't like the fact that the last few times they've been changing/raising the prices on me because I tip well. I told my friend id give them one last chance and they blew it. I'm never coming back here again. Didn't even offer an appointment or apologize. Just said were closed we close at 7 which isn't true because each time i came in I would come between 7 to 730 and get serviced. At least act like you care and offer an alternative solution.",0,eguB3eXzLRK3h40Oi0Iw3g
-6AFQalhxzBHv6flajuo_w,0,2018-05-11 02:08:13,0,cM6z-QSyT5fiY3_OQjzphQ,1.0,I came in at 6:30 to get a pedicure. Granted the salon closes at 7 and this was my last choice before my flight. The nail tech finished my pedi in 17-20 min. She did the basics trim file buff and scrub before my feet even touched the water.,0,EYEJbItHSQzGzT6nojfPMw
-6GJMc_Ln7csmvWWvY2iug,0,2015-01-04 08:03:36,0,x9hw6EQTa-Ml9eFz7sWjnA,2.0,"Wings are great, service is attentive.
Not polite, but attentive.
The one thing I recommended that you do here is to keep tabs on what you ordered and how much of it.
I just got home from a Saturday night spent at The Fox. A friend and I ordered a couple of apps and a pound of wings each as well as some pints. I happened to count the amount I consumed but was charged an extra 2 pints that I didn't even order. I raised a complaint yet still paid my bill.  The server didn't agree when I expressed my disappointment at being charged for something that I didn't order, much less consume. When I approached the Owner to voice my displeasure of being charged extra, he confronted me at the front door, had his bouncer block the front door, even though I paid my bill in full, accused me of being drunk, and told me that my business isn't wanted here.",0,7L76mw_2YvBV6tVz691xyA
-6GJMc_Ln7csmvWWvY2iug,0,2016-08-14 13:44:49,0,7TbnLmpb2KcErNRzYClgcQ,1.0,"Not happy with this place. Burnt and over priced nachos.. Service was horrible as well. 

Wings weren't bad but could have been better or at least served hot. Won't be back to this place.. Avoid it....",0,NelS4z7ztNylGgNlB-u-Vw
-6GJMc_Ln7csmvWWvY2iug,0,2017-06-18 23:34:39,0,IW33xQh3c8iI8Awgz3g3rQ,1.0,"Absolutely disgraceful service. 

We ordered two orders of fish tacos and after waiting for what seemed like forever, we decided to ask about our order. After the waitress checked, she said the cooks didn't make them because they didn't know they were part of the late menu (they have a different food menu late, and apparently the cooks don't even know their own menu). So we said okay and continued to wait. One order of fish tacos eventually arrived (2 tacos), and we assumed the next would follow so we each ate one. However, after waiting for another long time, we asked about our order again they said that they forgot we ordered two.

Not only did our food come really late, we only got half of it. At this point we voiced our disappointment. The manager then came out and spoke with us and gave us a half-assed apology and still made us pay for the order, which cost $12!!! Any reasonable food business would of taken care of that meal for free. They chose $12 over customer satisfaction and losing customers for life. And not just us because we will definitely spread the word.",0,Sbb5m-itS61ADTUckmUWjA
-6GJMc_Ln7csmvWWvY2iug,0,2018-04-06 22:33:51,0,J3MtrVQ7gRAzPTLFAhqd2w,4.0,"Even though I live just around the corner from The Fox and Firkin, I'm pretty sure this was only my second visit to the restaurant. I'm a sucker for a comfy booth and this joint's got quite a few, so I'll definitely be returning on a far more regular basis.

But how's the food, you ask? It's pretty typical. It's neither terrible nor delicious, which is exactly what I would've expected from such an eatery. On the day I was there, they had a pretty decent deal for their Firkin Burger (\"Jack, bacon, caramelized onions\"), so obviously that's what I went for.

It's an enormous burger. It's piled high with toppings, including a few that aren't even listed. (Onion rings!) Even after you smush the whole thing together, it's still a little too big to cram into one's mouth, but I somehow made it work. Everything works pretty well together, although I can't possibly tell you what the quality of the actual patty was like.

The service was solid and the beer was tasty. All in all, a fine way to spend an hour or so.",0,iRQ_YKpCBdaCwvc2X8_3NQ
-6GJMc_Ln7csmvWWvY2iug,0,2018-06-20 21:37:26,2,J6JDVEXwMXSeMj1xt0iuuQ,2.0,"I'm in here right now leaving this review because I don't want to forget this one. My partner had the fish and  chips and it was good I on the other hand had the shepherds pie aka soup. As an Irishman I was appalled. Put that pie on the soup menu. I needed a spoon to eat it. The staff are friendly, turn the 16 year old music down please, everyone in here is over 30 and the headsets on????",0,GFtn06TL7KcxUMdRHHql-A
-6GJMc_Ln7csmvWWvY2iug,1,2011-04-25 21:12:45,1,uLBR-QPFlSRecItUkBkjvQ,2.0,"ok out of all the Yonge and Eg pubs, this is the worst in my opinion, but really it's not that bad.

It's one floor going all the way to the back, but they have a patio too. But the patio is kinda hidden in the back and so when you eat there, it feels like shit is flying into your food from all the construction happening behind the building/too loud. 

This is why my lunch crew stopped coming here on fridays. It seemed like the construction was never going to stop (over two summers now).

But at the end of the day, it's a firkin with firkin food and firkin beer. and it's cold beer.",1,yT_QCcnq-QGipWWuzIpvtw
-6GJMc_Ln7csmvWWvY2iug,1,2014-05-28 01:00:39,0,otRytA3jm8c1MP3mUVlw9Q,4.0,"Great little place at Yonge and Eglinton. From burgers to comfort food we are always thrilled with the service and the quality of the food. 

The drink specials and daily specials are always different which keeps us coming back",1,FWvAdvaQx02yZKdvr8HpLQ
-6h3K1hj0d4DRcZNUtHDuw,0,2013-10-10 18:55:47,0,kD-ykvN30Po_Nv2CdtHFPw,2.0,"Normally Brio is great, you know what your getting but the time I went to this location it was sloppy. Everything was thrown together as if the staff was anxiously waiting to get off and had checked out for the day.

The food was fine but no one was paying attention. We waited forever for a refill on the water, our burger came out at the wrong temp, we asked for sauce and small things on the side and they never came. Dissapointing Brio, step up your game !",2,vzWcbVVCPF-2EOXtTvVX5g
-6h3K1hj0d4DRcZNUtHDuw,0,2017-07-14 00:50:33,0,DR5lWKnMnEsPnc8PXNtJ0A,5.0,"Love this restaurant but especially the Happy Hours. Great food, great value and great staff. You can't go wrong with the happy hour Brio burger or the peppered shrimp. My husband and I especially like to sit at the bar and visit with the bartenders. Brendan is awesome. Always a great time.",0,JJm5w0ueA2l2CtBkW9bgiQ
-6h3K1hj0d4DRcZNUtHDuw,0,2019-01-02 03:46:34,0,cbnY4MVOz53e0-3e7-2vQw,5.0,Terrific service and meal. Wes took extremely good care of us. We will definitely be back soon.,0,JMMaMaoZ1qOvh4L77cAoLQ
-6h3K1hj0d4DRcZNUtHDuw,0,2019-03-10 22:46:28,0,iFVSoQhkvAGXyK4j5NPA2g,1.0,There is nothing worse than driving 40 mins to go to a restaurant to order a specific item to find that it has been removed from the menu.  Our favorite bruschetta trio was changed seasonally and it was always fun to see what the Chef would come up with !  Now with it completely off the menu I guess it's time to start looking for a new place to grab Saturday lunch,0,HYiq760iqynUUqlB_E1tgw
-6h3K1hj0d4DRcZNUtHDuw,0,2019-03-25 05:05:22,0,x2CmQ60nrudL83r03sG26A,4.0,"I had the steak medallions with gorgonzola, my daughter had the grilled salmon fresca. I replaced the potatoes with sauteed spinach. All was cooked to perfection. The sauce on the medallions had a slight maple flavor. The salmon was cooked to perfection, she would get t next time without balsamic (her preference). We both had lobster bisque(excellent) and caprese salad (enough for 2). The waiter Drew was great, and host Lawrence was fantastic! Good atmosphere, quick service.",0,5qim4Gec8KP7mBfKbtSMOQ
-6h3K1hj0d4DRcZNUtHDuw,0,2019-05-23 20:51:13,0,RBW29ABLHwdDh6MM6pvRlA,2.0,"Edible - food is nothing special.  Only location going for it.  Lots of other way better Italian in the area - Tutti Santi, North, Giuseppe's, Uncle Louie, Sicilian Butcher, etc.",1,roPBAd7scIioW_HkAmTkeg
